{
  "schema_version": "invoice.v1",
  "doc": {
    "doc_id": "DOC-9f1b9c50321f",
    "doc_type": "invoice",
    "invoice_number": null,
    "purchase_order": null,
    "issued_at": "2025-12-30T02:53:13.171Z",
    "service_period": null,
    "currency": "USD",
    "raw_text_hash": "9f1b9c50321f4f6e5710717c359eb7ff287c7e1d9161b2837bc97a2a00420af0",
    "tags": []
  },
  "parties": {
    "vendor": {
      "name": "Unknown Vendor",
      "normalized_name": "unknown vendor",
      "addresses": []
    },
    "customer": {
      "name": "Owens Corning",
      "normalized_name": "owens corning",
      "addresses": [
        {
          "raw": "OWENS CORNING, MINNEAPOLIS, MN 55430-3793",
          "street": "OWENS CORNING",
          "city": "MINNEAPOLIS",
          "state": "MN",
          "postal": "55430",
          "country": "US",
          "confidence": 0.85
        }
      ]
    },
    "bill_to": null,
    "ship_to": {
      "name": "Owens Corning",
      "normalized_name": "owens corning",
      "addresses": [
        {
          "raw": "OWENS CORNING, MINNEAPOLIS, MN 55430-3793",
          "street": "OWENS CORNING",
          "city": "MINNEAPOLIS",
          "state": "MN",
          "postal": "55430",
          "country": "US",
          "confidence": 0.85
        }
      ]
    }
  },
  "line_items": [],
  "totals": {
    "invoice_total": null,
    "weekly_equivalent_total": null,
    "notes": []
  },
  "signals": [],
  "opportunities": [],
  "provenance": {
    "source_type": "chrome",
    "captured_at": "2025-12-30T02:53:13.171Z",
    "parser": {
      "name": "ingest.chrome",
      "version": "1.0.0",
      "warnings": [
        "No line items found in payload (checked multiple candidate keys)."
      ]
    },
    "source_ref": {
      "kind": "unknown",
      "value": null,
      "mime_type": null
    }
  },
  "confidence": {
    "overall": 0.6,
    "fields": [
      {
        "path": "parties.customer.name",
        "score": 0.3,
        "method": "unknown",
        "evidence": []
      },
      {
        "path": "line_items",
        "score": 0.1,
        "method": "parsed",
        "evidence": []
      }
    ]
  }
}