{
  "schema_version": "invoice.v1",
  "doc": {
    "doc_id": "DOC-ef67f510cf97",
    "doc_type": "invoice",
    "invoice_number": null,
    "purchase_order": null,
    "issued_at": "2025-12-23T23:31:56.121Z",
    "service_period": null,
    "currency": "USD",
    "raw_text_hash": null,
    "tags": [
      "location:real invoice demo"
    ]
  },
  "parties": {
    "vendor": {
      "name": "Cintas",
      "normalized_name": "cintas",
      "addresses": []
    },
    "customer": {
      "name": "real invoice demo",
      "normalized_name": "real invoice demo",
      "addresses": []
    },
    "bill_to": null,
    "ship_to": null
  },
  "line_items": [
    {
      "line_id": "L1",
      "raw_description": "FR JEAN / CARHARTT / RELAXED FIT / DENIM",
      "normalized_description": "fr jean / carhartt / relaxed fit / denim",
      "sku": "X280",
      "quantity": 9,
      "unit_price": {
        "amount": 0.67,
        "currency": "USD"
      },
      "frequency": "unknown",
      "attributes": {},
      "confidence": {
        "overall": 0.95,
        "notes": [
          "HAS_DESCRIPTION",
          "HAS_QUANTITY",
          "HAS_UNIT_PRICE"
        ]
      }
    },
    {
      "line_id": "L2",
      "raw_description": "FR SHIRT / ANSI CLASS 3 / YELLOW / LS",
      "normalized_description": "fr shirt / ansi class 3 / yellow / ls",
      "sku": "X59294",
      "quantity": 11,
      "unit_price": {
        "amount": 1.08,
        "currency": "USD"
      },
      "frequency": "unknown",
      "attributes": {},
      "confidence": {
        "overall": 0.95,
        "notes": [
          "HAS_DESCRIPTION",
          "HAS_QUANTITY",
          "HAS_UNIT_PRICE"
        ]
      }
    },
    {
      "line_id": "L3",
      "raw_description": "FR OVERALL / QUILT-LINED BIB / NAVY",
      "normalized_description": "fr overall / quilt-lined bib / navy",
      "sku": "X78150",
      "quantity": 1,
      "unit_price": {
        "amount": 1.98,
        "currency": "USD"
      },
      "frequency": "unknown",
      "attributes": {},
      "confidence": {
        "overall": 0.95,
        "notes": [
          "HAS_DESCRIPTION",
          "HAS_QUANTITY",
          "HAS_UNIT_PRICE"
        ]
      }
    },
    {
      "line_id": "L4",
      "raw_description": "FR PANT / 88C12N / NAVY",
      "normalized_description": "fr pant / 88c12n / navy",
      "sku": "X371",
      "quantity": 11,
      "unit_price": {
        "amount": 0.38,
        "currency": "USD"
      },
      "frequency": "unknown",
      "attributes": {},
      "confidence": {
        "overall": 0.95,
        "notes": [
          "HAS_DESCRIPTION",
          "HAS_QUANTITY",
          "HAS_UNIT_PRICE"
        ]
      }
    },
    {
      "line_id": "L5",
      "raw_description": "FR JEAN / CARHARTT / RELAXED FIT / DENIM",
      "normalized_description": "fr jean / carhartt / relaxed fit / denim",
      "sku": "X280",
      "quantity": 11,
      "unit_price": {
        "amount": 0.69,
        "currency": "USD"
      },
      "frequency": "unknown",
      "attributes": {},
      "confidence": {
        "overall": 0.95,
        "notes": [
          "HAS_DESCRIPTION",
          "HAS_QUANTITY",
          "HAS_UNIT_PRICE"
        ]
      }
    },
    {
      "line_id": "L6",
      "raw_description": "FR SHIRT / ANSI CLASS 3 / YELLOW / LS",
      "normalized_description": "fr shirt / ansi class 3 / yellow / ls",
      "sku": "X59294",
      "quantity": 11,
      "unit_price": {
        "amount": 1.14,
        "currency": "USD"
      },
      "frequency": "unknown",
      "attributes": {},
      "confidence": {
        "overall": 0.95,
        "notes": [
          "HAS_DESCRIPTION",
          "HAS_QUANTITY",
          "HAS_UNIT_PRICE"
        ]
      }
    },
    {
      "line_id": "L7",
      "raw_description": "FR INSULATED LINER",
      "normalized_description": "fr insulated liner",
      "sku": "64356",
      "quantity": 9,
      "unit_price": {
        "amount": 2.5,
        "currency": "USD"
      },
      "frequency": "unknown",
      "attributes": {},
      "confidence": {
        "overall": 0.95,
        "notes": [
          "HAS_DESCRIPTION",
          "HAS_QUANTITY",
          "HAS_UNIT_PRICE"
        ]
      }
    }
  ],
  "totals": {
    "invoice_total": null,
    "weekly_equivalent_total": null,
    "notes": []
  },
  "signals": [],
  "opportunities": [],
  "provenance": {
    "source_type": "chrome",
    "captured_at": "2025-12-23T23:31:56.123Z",
    "parser": {
      "name": "ingest.chrome",
      "version": "1.0.0",
      "warnings": []
    },
    "source_ref": {
      "kind": "url",
      "value": "file:///Users/taylorray/Desktop/real-invoice-demo.html",
      "mime_type": "text/html"
    }
  },
  "confidence": {
    "overall": 0.75,
    "fields": [
      {
        "path": "parties.customer.name",
        "score": 0.3,
        "method": "unknown",
        "evidence": []
      },
      {
        "path": "line_items",
        "score": 0.9,
        "method": "parsed",
        "evidence": []
      }
    ]
  }
}